MCQ,Choices,Correct
What is biology?,a: The study of rocks | b: The scientific study of life | c: The study of outer space | d: The study of economics,b
What is a major theme in biology that explains the unity and diversity of life?,a: Evolution | b: Chemistry | c: Physics | d: Mathematics,a
"What allows organisms to move, grow, and reproduce?",a: Energy processing | b: Photosynthesis | c: Cell division | d: Respiration,a
What is the scientific method used for in biology?,a: To make money | b: To make friends | c: To make observations and form conclusions | d: To make art,c
How long ago did life on Earth emerge?,a: 3.7 million years ago | b: 3.7 billion years ago | c: 3.7 thousand years ago | d: 3.7 trillion years ago,b
